<?xml version="1.0"?>
<xs:schema version="1.0"
           xmlns:xs="http://www.w3.org/2001/XMLSchema">
    <xs:element name="BookStore" type="BookStoreType"/>
    <xs:complexType name="BookStoreType">
        <xs:sequence>
            <xs:element name="book" type="bookType" minOccurs="1" maxOccurs="unbounded"/>
        </xs:sequence>
    </xs:complexType>
    <xs:complexType name="bookType">
        <xs:sequence>
            <xs:element name="Title" type="xs:string"/>
            <xs:element name="Author" type="xs:string"/>
            <xs:element name="Date" type="xs:date"/>
            <xs:element name="ISBN" type="xs:integer"/>
            <xs:element name="Publisher" type="xs:string"/>
        </xs:sequence>
    </xs:complexType>
</xs:schema>
